,Cleaned tweet,Tag
1539,I am also an immigrant and I have suffered discrimination when They did not want to sell me gasoline in northern Florida because I spoke Spanish with those who accompanied me,0
1540,This undesirable complains that those who arrive by boat are in good condition He would have preferred them to arrive dying it seems Racist and xenophobic,0
1541,Dont be short or worse yet What Mr Negre is saying is that it is impossible for a boat to have occupants in good condition after having traveled two hundred miles and who supplies them with fuel and supplies Do you know how long it would take to get there Calculate knotsh,0
1542,Residual exceptions where it does not benefit us that they do not alter the total count such as mafias or what some believe are the menas As I say the evidence that immigrants contribute more is incontestable no matter how you look at it Even though there is unemployment,0
1543,One spends so much time being an immigrant that sometimes one forgets that one is an immigrant I dont know if you understand what I mean,0
1544,In the Hospital they use surgical procedures and if it were up to Garzn I would provide them for free They flee from the shitty life they have to build a better future and they do it as best they can They wouldnt really like going on a boat,0
1545,The Ethiopian immigrant who became the symbol of integration in Italy through,0
1546,There are people who dont just as there are working class homosexual or immigrant people who are faa,0
1547,Hahahahaha every time I call Ana an orphan I get tempted to laugh what shitty black humor,0
1548,The song is Ilevan Polka a Finnish polka from the early th century and the man is a blind Turkish immigrant percussionist who emigrated to Finland and they thought the cat was being moved to make it look like it was nodding I hope not,0
1549,Damn flat that I have upstairs,0
1550,In my job they dont dare to tell me that because I am the immigrant,0
1551,Fag literally the university offers me new scholarships every month what its like to be a Latino immigrant faggot with good grades,0
1552,They treat me as if I had arrived as an illegal immigrant some even think Im going to take away their jobs but despite all those things it hasnt gone that bad for me and here is my top streamers Im going to get on the mame train,0
1553,Getting an immigrant visa is difficult I think it is better to look for a job,0
1554,Congratulations you are another immigrant who achieved the dream with a royal attitude to tell it May God take care of you and give you more prosperity,0
1555,Oh crazy I cant share memes on Facebook for hours for calling my cousin fucking black in a comment the fucking motherfucker,0
1556,Lets see that you get on my nerves when you go on boats and they discriminate against you when they call you moor of shit or when they literally say that you come to steal you give me lessons in racism Of course you dont know because surprise YOU ARE WHITE AND THEY DO NOT SYSTEMATICALLY DISCRIMINATE YOU,0
1557,A country of immigrants that devastated the native peoples to this day What an irrational question they should censor you Welcome every immigrant surely anyone is a better person than you,0
1558,It doesnt surprise me that relatives continue to use the fucking black Afterwards on Facebok we are all good THE BEST,0
1559,Blablabla I am also an immigrant in another country and I had to change my customs because I am the guest and I am the one who had to adapt not the other way around,0
1560,What a shame that some of you cant even tell the difference between a legal immigrant and an illegal one He has allegedly committed a crime another gem There is the presumption of innocence not the presumption of crime,0
1561,Im older than you but I met him in the eighties because he was the son of an immigrant,0
1562,very prolife but I would let you die in the middle of the sea for being an immigrant,0
1563,Grandpa but you dont even know the difference between an immigrant and an emigrant,0
1564,Igea offers Castilla y Len to welcome menas,0
1565,It breaks my balls that they say lets save both lives and when they see a kid on the street they call him a fucking nigger they dont even approach him with a stick they completely ignore his situation,0
1566,Troops save migrants of subSaharan origin when they were adrift south of Those rescued have been transferred to Arguinegun and are in good health,0
1567,I understand that the person who took the photo was the blocks grocer Don Henrique Crtier Bressones a French Basque immigrant like you,0
1568,Is there any person on Earth who is not an immigrant,0
1569,If the immigrant does not comply with the law of the country that arrives it is because the country that welcomes them does not enforce the law,0
1570,The family had asked that photos not be released yet and the truth is that I agree that they stop saying if she is trans or an immigrant because that does not matter What matters is that this person killed Mara Isabel and deserves to receive the full weight of justice and more,0
1571,Sorry bro these days I have the house as a flat and I havent been able to play much,0
1572,Thats NOT THE ISSUE I dont understand how from a country that sends emigrants immigration is not understood since everyone emigrates for the same reason Whoever from here asks to disrespect immigrants does not respect their own immigrants,0
1573,Well of course there is How many Africans arrive in the US by boat crossing the sea None Does the US not steal from Africa Of course they do but they dont go because they know its impossible Here it could be resolved but it is cheaper not to do it and let some drown,0
1574,Jesus Christ today would drown in the sea trying to cross in a boat,0
1575,Is there any person on Earth who is not an immigrant,0
1576,WHAT DOES IT MATTER if he is trans a woman an illegal immigrant or a friend of the other sick person the important thing is that HE IS A FEMALE AND HE IS LOOSE,0
1577,I like the ones on the right but Im too lazy to peel them and on top of that I even remove the shitty black line they have because it makes me sick so in the end I dont eat any out of laziness,0
1578,What is impossible is to cross hundreds of kilometers of sea in a boat Another thing is that they pick you up at sea minutes after leaving and take you by boat You only have to protect a few really close points and an immigrant would never drown at sea again,0
1579,I miss the pateradyllera apartment,0
1580,Its a memory I have of my Portuguese immigrant dads grocery store,0
1581,Simply admirable I speak as a grateful immigrant,0
1582,You have no fucking idea What the menas are is children Minors Everything else is the racism that appears in your tweets,0
1583,Jesus Christ was an immigrant and he was a communist He start using hydrogen peroxide for the wound,0
1584,How are you going to be an immigrant in your own country You say nothing but nonsense Joseph and Mary were going to register in their own city,0
1585,Civil Guard intercepts immigrants in a boat This Friday the maritime service of the Civil Guard transferred to the port five people of Moroccan origin who were sailing on a boat that was intercepted near Almucar,0
1586,This Thursday the Maritime Rescue BoatTaxi picked up immigrants from Morocco from a boat bound for Cdiz in the waters of the Strait of Gibraltar Helena Maleno notified at pm and within half an hour they were on board Now they bring in a woman and her child to put pressure on them,0
1587,True being a European immigrant in the UK is not going to be easy Im afraid Those who have already resided for years are covered by the Withdrawal Agreement Those who dont will suffer uncertainty,0
1588,Well yes I prefer that they give help to an immigrant who is fleeing from fucking war and poverty rather than to you who live in the first world complaining that they dont give you help because you cant make ends meet when you have your children in a concert you live under one roof,0
1589,Practicing Catholic offended by this tweet why are you offended if you are not one of those who demonstrate either on the street or on social media against the migrants who arrive by boat Or if you do why does the tweet bother you,0
1590,Today you would have let JESUS die on the high seas because he was an IMMIGRANT PHARISEES Days I DISGUST PARASITES,0
1591,I love not being needed in a xenophobic country it is an honor for me I cant stand insults or contempt I know how to defend myself by not putting my feet there but a Spanishspeaking immigrant does not expect those attitudes,0
1592,The number of migrants arriving by boat to the province of Malaga has dropped by more than half compared to the previous year,0
1593,One of the three migrants hospitalized after being rescued last Christmas Eve in Motril dies With his death there are now five people who were sailing on the rescued boat who have lost their lives Alba Feixas,0
1594,Motril An immigrant dies of hypothermia after being assisted at the Hospital,0
1595,Thank you Gabriela It concentrates the essence of my nostalgia for Venezuela My children now adults and parents lived with this melody in their childhood and it accompanied me forever in my years as an immigrant Beautiful gift,0
1596,Venecos I dont understand xenophobia Why so much hate Enough segregation for the Venezuelan immigrant Also Venecos,0
1597,Wow now the antiChristians are giving us lessons in Christianity Their ego is so big that they must give lessons even about what they dont know I hope you welcome an immigrant into your home instead of giving us moral lessons that you dont apply to you Too much hypocrisy and too much ego,0
1598,I read this article a long time ago and I find it beautiful moving and at the same time very useful because it talks about concrete tools to survive when you are an immigrant,0
1599,Why dont you put photos of those who will die on the high seas because of your refusal to help immigrants who risk their lives on a boat,0
1600,According to the gospel of Matthew Joseph Mary and Jesus had to flee to Egypt because an angel ordered the former warning him of the imminent massacre of the innocents ordered by King Herod So the immigrant and refugee thing well it seems so,0
1601,Merry christmas To a Christ who was an immigrant and dreamed of a more just society,0
1602,Today it symbolizes the birth of an immigrant poor without a biological father persecuted and judged without knowing him And that he advocated love for all without distinction Fundamentalisms that persecute and condemn in his name do not fit here MERRY CHRISTMAS TO EVERYONE EQUALLY,0
1603,Hahahahahahahahahahahahahahaha Im not an immigrant but if I were whats wrong with it Is it a bad thing to want to look for a better place to live somewhere else We all have roots from other places because migration has always existed So dont talk stupid lady,0
1604,They are so hypocritical that they worship a poor immigrant,0
1605,TRUE Its not easy being an immigrant There are typical customs and foods from other countries that are ugly And many times it is not that they do not seek to adapt but that people are exclusive It is not like in Venezuela that foreigners are part of the Venezuelan life,0
1606,Thanks Rush You helped me discover the conservative part within me Thanks to you I have gone from being a mediocre immigrant citizen to a citizen who loves and seeks the best for this our USA With God hope never dies,0
1607,A great story of the destiny of a small business in New York with an immigrant as the endearing protagonist What Happened When Henry Yao Almost Went Bust,0
1608,Jesus was in reality an immigrant at the time of his birth since Jose was looking for a place to live quietly and be able to work and Maria his wife was waiting for Jesus Jesus did exist and if he were here now he would support the most dispossessed,0
1609,How hard you must be with such ugly feelings towards others I am an immigrant here and I give you my support if you want to get out of that moral vileness I will gladly help and support you There is another possible life,0
1610,Nobody talks about criminalizing they are simply different ways to obtain citizenship In Fr if you study at a U and stay two years you can apply or work for etc and note that I am an immigrant in France,0
1611,Mexican immigrant talks about her experience and why she supports the president via,0
1612,Now Playing Amame by Tico El Inmigrante Ft Franco El Gorila Visit,0
1613,A Jewish immigrant in Judea is like saying a Spanish immigrant in Spain or a Turkish immigrant in Turkey,0
1614,Friend Ill tell you something Im an immigrant and what they told you is a big lie Without papers I recommend not coming Its a complicated country If you dont have documents its better to make everything legal Those who have reported themselves although they are not in prison or anything like that but yes things have gone very badly for them,0
1615,Compared to the people counted in Malaga in this year immigrants have been rescued and transferred to the port of Malaga according to data from the Government Subdelegation,0
1616,Because we understand that when an immigrant arrives in a new country it can take a month or two months to stabilize I understand that because I was also a migrant but gentlemen all this time these immigrants are supposed to be working not pimping out a state,0
1617,Because when countries give you donations it is to help not only the immigrant but also those who are in the country who are the ones who pick up the garbage so help has to come in one way or another,0
1618,Two young Africans rest next to a boat while watching tourists enjoy the Puerto Rican beach in Mogn Gran Canaria My photo from today in,0
1619,That is what is needed for you to be considered STATISTICALLY as immigrants Its easy A German who goes from Munich to Hamburg is not an immigrant nor is an Italian who moves from Naples to Rome,0
1620,Now no matter how you feel about it internal movements between people from the same country are not an immigrant population In Spain and throughout the world those from outside the country are counted as an immigrant population,0
1621,I am an immigrant with two years and I have been undertaking for a few months A month ago I formed my own company and said goodbye to my comfort zone I admit it has not been easy due to my position but it has been the most satisfying Thanks chile,0
1622,We come in the evening and into the night going The phrase is from the poet Vicente Gerbasi in My father the immigrant It is spoken by a Venezuelan friend who moved to Chile fleeing neocommunism He fears that something similar will arise from the Chilean constituent process,0
1623,people rescued from a boat in the Strait of Gibraltar,0
1624,If I go to visit Catalonia and fall in love with that beautiful land and decide to stay and live there I am neither an immigrant nor do I intend to Spanishize Catalonia,0
1625,If an unemployed Galician finds a job in Catalonia and moves there he is NOT an immigrant who is going to Spanishize Catalonia,0
1626,And I dont care how many followers and mutuals are bothered by my taking a clear position on this issue If a Murcian gets a Catalan girlfriend and goes to live there he is NOT an immigrant who is going to Spanishize Catalonia,0
1627,The number of migrants arriving by boat in Malaga drops by more than half in,0
1628,The number of migrants arriving by boat has decreased by more than half to people in According to the number of boats it has also decreased from in to this year,0
1629,Maritime Rescue has rescued this Thursday south of Motril people of subSaharan origin who were traveling in a boat adrift in the Alboran Sea A plane from the Customs Surveillance Service sighted the vessel via,0
1630,An Extremaduran in Catalonia a Galician in Madrid or a Balearic in Castilla y Len is not an immigrant crack,0
1631,Immigrant family starts a successful business with only in Los Angeles,0
1632,immigrants including a child rescued from a boat are transferred to Algeciras,0
1633,Miguel Georgalos also received advice from a Lebanese immigrant also from the Floresta neighborhood whose name I do not remember Halva is a derivative of halawa the original sesame sweet of Arabic origin I look like the old man from My Great Greek Wedding but Arabic,0
1634,migrants rescued from a boat in the Strait of Gibraltar,0
1635,Venero Law is a law firm that defends your rights as an immigrant Everyone speaks Spanish and most of the paralegals are Venezuelan They will be able to advise you and fight for your rights Contact them at or operations com,0
1636,I didnt want to say anything to my parents or my sister because they would have prevented me from leaving they know that many people die at sea Hours before getting on the boat I secretly cried thinking about my mother And when you arrive a dead end,0
1637,Hours before getting on the boat I secretly cried thinking about my mother via,0
1638,There is the Spain of Santa Claus that of the Three Wise Men that of Olentzero that of Nadals Ti and that of to unite us all As on so many occasions an immigrant from outside has had to come to remind us that we are better people than we think we are,0
1639,This Saturday afternoon Salvamar Menkalinn rescued immigrants who were heading in a boat and a canoe to the southern coast of Gran Canaria Maritime Rescue sources have informed Efe,0
1640,I congratulate you on Christmas with what a little African who came in a boat told me What I like most about Spain is going to school,0
1641,The Canary Islands ask for help to manage ores and only receive an offer to relocate,0
1642,My wife is an immigrant But she accepted the customs and laws of Panama She even belongs to a political party She was a professor at technology and at USMA She retired from IDIAP When I was in Brazil studying I adapted without a problem,0
1643,Now from the sinuous duplicity of upbringing I surprise myself by confirming something that I already sensed there is no point of return for an immigrant it is a conscience that never leaves you says Daniela Surez here Raising in a moving matrix This Country,0
1644,If there are families of Moroccan origin who have been living in Melilla for several generations I believe they are Spanish Mustaf Aberchn for example is Spanish by birth He wouldnt call him an immigrant Furthermore all of his voters have Spanish nationality if not by birth,0
1645,I agree with that immigration must be regulated unfortunately this has already become very dangerous but the immigrant deserves the same respect and dignity as everyone as long as they dont send shit,0
1646,This Saturday afternoon Salvamar Menkalinn rescued immigrants who were heading in a boat and a canoe to the southern coast of Gran Canaria Maritime Rescue sources have informed Efe,0
1647,Exploited and mistreated and now they come a lot to say that we gave everything to the Colombians I tell you something when I lived in Viga I saw it as normal one is indoctrinated by what people say but now I am an immigrant and I realize how hard and bad we went with the Colombians,0
1648,INFORMATION We are collaborating tonight with the location of a boat southeast of Morro Jable Pjara in the area until arrival and rescue by Guardamar Polimnia Tension screams and cries with a happy ending great job,0
1649,I mean yes its working at night its a pain especially because of his age but the fact that the company took it into account and gave him that opportunity as an immigrant hell thats commitment or maybe its not Since I have never seen such a thing here it seems magnificent to me,0
1650,Day of confinement and the desperation is notable I dont want to imagine the desperation of those who get on a boat in this cold knowing that they are risking their lives All our problems are one thousandth of the problems in the world,0
1651,Dont miss this powerful film about a young immigrant who is torn between her family and following her dream of singing Enter the link and enjoy this premiere now available on various platforms to watch at home,0
1652,Boat arrival at the Puerto del Rosario Dock people men women and two minors in good health,0
1653,I congratulate you on Christmas with what a little African who came in a boat told me What I like most about Spain is going to school,0
1654,Events Seven people rescued from a boat in the Strait are transferred to the port of Algeciras via,0
1655,Story with a good ending for everyone Hungarian immigrant in the USA who ends up going to work in Germany in a company founded by a Turkish immigrant The emigrants,0
1656,In Spain there are million people You go to any shopping center these days and everything is packed without keeping distance without wearing masks people on terraces and in bars but of course COVID and everything is to blame for the four poor little ones who arrive in a boat,0
1657,Hello I hope you had a nice Christmas Above all not alone it must not be easy to be an immigrant and with your family far away even if you are famous When are you going to sing Chilito to us again,0
1658,You think you are cured of being an immigrant until a person comes asking you everything about your country of origin and tells you beautiful things,0
1659,BRUTAL story of the immigrant who found things very ugly because no one believed in her crazy ideas of using mRNA as vaccines,0
1660,New arrival of a boat at the Puerto del Rosario Dock after being intercepted by The health device assists people men women and two minors in good health There are no transfers to health centers,0
1661,I voted for VOX in the last elections and I cant think of less appreciating anyone because of their skin color Mainly because I am an immigrant in another country,0
1662,The truth is that I doubt that in it was like that She was years old and she rode her bike alone around the neighborhood and went to school My immigrant grandfather she settled there He was the founding member of the Nas Dom instit and my father is the president today at years old My parents and other neighbors managed to have,0
1663,The worst thing that could happen to the immigrant community in was Trump The good thing is that he is already leaving on January at noon,0
1664,NATIONAL These people were sailing in a boat and a canoe and have been disembarked in the port of Arguinegun in the south of the island,0
1665,A patrioticmigratory song by Carlos Javier Jarqun about Fabio Mendoza Obando and his collection of poems Perpetual Immigrant Traces,0
1666,Can you contract a US citizen with a nonimmigrant license and obtain adjustment of status of Immigration in Bering Dr Houston TX,0
1667,Through a virtual presentation via Zom neighbors were able to tour the content of the Italian Immigrant Museum A night to learn about the daily life of the Italian community,0
1668,Well my dad taught me not school or my mom just my dad I suppose that being an immigrant he keeps it in mind The crisis takes everything but it also necessarily pushes us to be better,0
1669,A boat with migrants on board was intercepted this Saturday in waters near the island of Fuerteventura,0
1670,There is nothing wrong with being an immigrant In fact it is a merit They deserve absolute respect whether they are from London Nairobi Murcia or Bastia And if they want they will be as Catalan as me,0
1671,IMMIGRATION A boat arrives in Los Crisitanos with occupants of them less on board,0
1672,The main source is the New Immigration Law about to be approved which basically establishes that no immigrant can be denied entry because no immigrant is illegal in short criteria from international organizations,0
1673,Immigrant in her twenties who spends her time working looking to make things happen to grow in her professional career I support my sister and myself so I am always stressed and with wine in the fridge,0
1674,An emigrant is a migrant but not always the other way around In both cases the focus is on the person who leaves home unlike immigrant which focuses on the person who has already arrived at their destination,0
1675,Controversial medical tests for unaccompanied migrant minors Throughout up to MENAs files have been carried out multiplying by three those carried out in,0
1676,The adjective immigrant is only valid depending on who says it If an Uzbek emigrates to Kazakhstan for a Kazakh he will be an immigrant but not for another Uzbek For a compatriot he would be an emigrant For himself he is both,0
1677,I am from Barcelona I arrived in Chile years ago I had Chilean friends I was a lucky immigrant with savings speaking the same language as the country Still immigration has difficulties and if I put myself in the shoes of a Haitian person I feel enormous vulnerability,0
1678,I understand Believe me I am a product of immigration and it seems unfair to me that for white European immigrants there are no obstacles but for brown black indigenous immigrants they are pure cries of scandal I am ashamed of the racism in this country,0
1679,Only if you are an immigrant you will surely cry with this video The reunion with what you love most is the best Christmas gift for a family,0
1680,I prefer an immigrant in a boat fighting for his future than that pureblooded Spaniard,0
1681,It is a hard book about an immigrant and gay boy it seems if I remember correctly autobiographical but very well written It is not the typical book to recommend lightly But I think you would like it If you dare tell me,0
1682,Isac Asimov Russian Jewish immigrant naturalized from North America wrote in his magnum opus History of the United States th volume that its citizens North Americans are the freest in the world He describes that time as the time of greatest individual freedom in the world,0
1683,Seven people rescued from a boat in the Strait are transferred to the port of Algeciras,0
