,Cleaned tweet,Tag
506,If they had had a boat as a means of transportation another rooster would have crowed to them At least with this government,1
507,The Spanish truckers stuck in the traffic jam are stupid If instead of having been working and paying taxes they had gone on a boat with a ball of hashish in their ass the Government of Spain would put them in a star hotel,1
508,Menas subsidy Truckers no subsidy There is no other explanation,1
509,Thats x working with a truck If you had a boat in the Canary Islands you will have accommodation as soon as you arrive,1
510,In the city of crime in Barcelona an immigrant robbing an elderly man,1
511,Marry a disgusting immigrant then,1
512,Lets see cocksuckers we Spaniards and foreigners who have passed through and have gone through the Tax Agency have paid for the vaccines Your friends the menas and the lazy ones who have not contributed in their entire lives those will benefit for the hell of it,1
513,I cant understand how a government president can be so inept and irresponsible The people of Madrid are confined and the government sends us the immigrants who arrived in boats who roam freely through the streets and Barajas A drain,1
514,Dont tell me anything an immigrant came to rent the house next door and since the th he hasnt stopped playing his shitty Central American music,1
515,Illegal immigrant murders his expartner and is now on the run Regulate fucking immigration,1
516,I dont know if its man woman beast or whatever but its repulsive Illegal immigrant and alleged murderer I hope they find him quickly and confirm his guilt so that hopefully he pays dearly The first thing would be to deport him and imprison him in his country of origin,1
517,That you arrive in a boat you have not contributed in your life and on top of that you are an illegal The Government of Spain gives you a hotel cell phone money and even condoms Are you a Spanish guy stuck in England Youre screwed For everything else MISGOVERNMENT OF SPAIN,1
518,Hey idiot find out and find out who the murderer was an immigrant from those lines of the coupist left,1
519,Hey and with all his balls he denies that the government is from Bildue Im pissing myself Damn youll cry when youre even poorer because this government is dedicated to giving away money to Menas and others,1
520,This affects our entire country with the arrival of so many immigrants our entire country is becoming poorer,1
521,Greetings The Progressive Sectarians continue to throw shit at Ayuso which is the only thing they know President works and goes out of her way for the health and wellbeing of the people of Madrid Others like Isa Serra provoke Vallecan KalesBorrokas and protect MENAS criminals,1
522,Are Moroccans really coming by boat to do military training on the beaches of Spain and they do nothing When there are attacks and people die the blame for this will lie with the politicians who let them in,1
523,With the support of they are going to spend per illegal immigrant to find work for them while they will screw you Spanish Were these the ones who came to change things,1
524,A damn immigrant attacks a poor Christian boy for no reason Even though the boy keeps saying Ok Ok,1
525,It makes me want to go to Morocco get on a boat and disembark in the Canary Islands What a joy hotel food women party I dont know what the hell Im doing getting up early to go to work honestly,1
526,A boat with migrants arrives on the coast of Fuerteventura Come on it costs bucks a day to shelter these lazy people,1
527,accompanying my mother for the covi test and without a waiting room The companions lying in the street Only if you arrive by boat great hotel and free planes The inheritance of the socialists giving away the money and spending it on parties without investing in healthcare,1
528,And are they going to give us a vaccine made from the previous strain I am supportive I give my cacuna to the menas and podemits,1
529,Ok fucking Moor next time bring an immigrant contract on the boat,1
530,It is more profitable for the Straits mafia to get a boat from these subSaharan kids than to bring bales of marijuana,1
531,It has stranded truck drivers in the United Kingdom Of course immigrants who arrive in a boat to Spain are put in a big hotel Government of useless and incompetent,1
532,fucking gypsy,1
533,Fucking MENAS Morocco to commit crimes against its country until when will the authorities continue to ignore the potential danger of this mob A young woman is injured after a bus is stoned in Copherfam,1
534,We have some Francoists at the next table saying that if they sink just one boat they wont come anymore and that the only thing Hitler did wrong was try to go after Russia instead of going after Africa,1
535,FRIEND trapped I can tell you you are in those situations with conditions for paying taxes if in the gloomy work of going down and contributing you were on a boat you would be in a star hotel in the Canary Islands,1
536,They are destroying our neighborhoods and they are destroying He brought dirt and crime That is the idiosyncrasy of those banana countries,1
537,Pure criminal immigrant from Central America who only comes to steal and disturb Mexicans,1
538,Well if he had governed we could imagine that Mary would not have had children because they would tell her to abort Joseph would have been placed in an LGBT beach bar and the wise men would not use a camel and would bring gifts they would come in a boat and ask for the payment she now she comes back for another one,1
539,Communism hates democracy and abandons SPANISH Communism supports the ETA TERRORIST AND supports the patera harming the SPANISH,1
540,Now its the lefts fault Manga of aweonaos defending an illegal immigrant,1
541,Keep in mind that VOX exists today and an unfortunate immigrant like you continues to live in SPAIN when you should have been kicked out and in Argentina a long time ago,1
542,I put you in a boat in the middle of the Atlantic calm Indian its humor,1
543,TREMENDOUS LEGACY FILLED US WITH FOREIGN CRIME AND THE STREETS WITH IMMIGRANT POVERTY,1
544,Hey TVE since you are the TV of the communist regime that we have do you know if anyone from the Bolshevik government has done anything for these people I dont think NO if they were in a boat and not in a truck you would see how quickly they would be in a hotel right,1
545,And I say wouldnt it be the resignation of or of the whole I put it as a case A lot of illegal immigrants are entering through the Canary Islands and Andalusia with Covid included and no one says anything And let it be known that I am not from the PP but the bread rises and Ayuso resigns,1
546,Because here we are good if not idiots it costs us each immigrant euros a day in those hotels which will surely be destroyed while there are Spanish families with serious economic and social dramas left unaddressed and with a country with more than billion public debt,1
547,BREAKING MINUTE A group of menas come to the door of the Galapagar palace to sing Christmas carols to Pablo Iglesias Among those present is Mohamed the one with the Decathlon bicycle and Mustafa the one who cleans his whistle in the fountains,1
548,Black fucking whore and falopera,1
549,In some ore centers in Andalusia they have removed several of them to send them to the Canary Islands with a contract to work as intermediaries,1
550,The look on the neoNazi wannabes face was epic On top of that served by a dirty immigrant,1
551,Patera of in the South of Tenerife Mohamed sends vaccines for the Canary Islands money for Mafias and NGOs,1
552,They only need some machine guns Maybe the weapons will arrive on the next boat Or they have them already hidden,1
553,Does anyone know if Pedro Snchez has already sent the Openarms to rescue our truckers Or does the felon only move with a kick,1
554,Are you an immigrant who comes illegally to exploit the incentives of political groups Multitude of economic and human resources Are you a Spanish truck driver who works hard and contributes to the wellbeing of others For you a switchboard redirected to Kuala Lumpur,1
555,Pussy What a cool analysis Im about to get into a boat so they can rescue me and thus get a salary and a nice house it hadnt occurred to me maybe because I respect everyone who works and I dont like slavers hobbies mine,1
556,Im from Barcelona and since Colau is here Barcelona is sad they are squatters manteros MENAS Romanians stealing on the subway or in tourist places and dp asks to buy from the small business when she has been fucking with the manteros now wants to look good,1
557,It takes less time if you are an African by boat from Morocco to Arguinegun than if you are a Spanish truck driver from Dover And the Red Cross awaits you upon your arrival,1
558,What better welcome than that of your own family at Casita Menas,1
559,I love paying taxes so that sick people can cut off their dicks and to support feminists and menas,1
560,Here in Valencia you could walk quietly through the Turia Garden and I say you could because you cant anymore Small groups of Menas some walking and others on bicycles seeing who is careless and could have their rifle or cell phone stolen Thank you Government and Generalitat for the gift,1
561,I am an immigrant and mestiza Im scared shitless every time I have to walk past a mob of Haitians Find out a little more about what you are defending,1
562,I havent said that its not racist but I do tell you again that you take them home and keep them many Spaniards dont want illegals Let them go and take their country for granted This is how many of us think and the immigrant who is legalized and commits a crime will also be expelled to his country,1
563,In Melilla with a population of inhabitants MENAs have snuck in to us all of them from our beloved neighbor country that loves us so much and maintains such good relations with Ceuta and Melilla Our Government does not want to know anything,1
564,Help to return them to their parents Let Morocco take care of them,1
565,For the truckers stuck in the UK Not a box of cookies They had to have entered in a boat or had a towel wrapped around their head so that they would be treated well,1
566,They did the same thing to me for saying what should be done with the gangs of male rapists,1
567,Ahhh and the immigrants and menas that they have sitting at their table to give them a plate of food and a roof And of course the President giving a speech asking for forgiveness and saying that the PSOE will return the money from the Andalusian ERE They are like to give an example to this scum,1
568,The MENAS can be on the street whenever they want you at they can not wear masks and infect everyone they steal with total freedom because they know that the next day they will be released and so on What a beautiful city they are leaving or country rather,1
569,Castizo FachaSmiz But hes a fucking immigrant,1
570,I dont have a house sir The podemites expropriated it from me to give it to some menas,1
571,If Podemos governed baby Jesus would have been brought Marijuana MENAS and a lot of unemployment Salu,1
572,Its not envy its hate Rotten with the million ERE and what is to come what they want is for you to pay more taxes to distribute it among themselves the menas and those in the unemployment line whatever they have left If Nadal donates a lot it shows more,1
573,No notice that just a few days ago we went to the call of a French warship to pick up a boat more than km from the Balearic Islands a boat that the French already had that deployment cost euros but to save these poor little ones that escape well combed,1
574,Its called humanity In other words it is not someone elses problem that someone has nowhere to live But they are followers of a man who was an immigrant persecuted for telling the truth and offering another way of life and so he was crucified Its called hypocrisy,1
575,They help the menas with pay and shelter They help squatters who occupy Spanish houses They help immigrants on boats with luxury hotels This government leaves Spanish truck drivers stranded Thanks to other countries and politicians for helping our truckers,1
576,At the beginning of the month he committed his crime calling himself Alfonso If he had arrived by boat he would have slept in a star hotel and danced with some red cross girl,1
577,That the government is more concerned about those in the Canary Islands than about truckers trapped in England says a lot about this country,1
578,They are neither transgender nor are they menas nor are they squatters They are fucking Spanish truck drivers trapped in the United Kingdom and forgotten by the ruling caste,1
579,Patera tourism does not seem to leave many benefits although occupancy seems to break records,1
580,The MENAS have parents and a known address in Morocco what the hell do they look like in our country They are criminals and have no solution IT IS NOT ABOUT RACISM it is realism The Canary Islands ask for help to manage ores and only receive an offer to relocate,1
581,The Canary Islands ask for help to manage menas and only receive an offer to relocate via children where they need to be is in their countries and with their families Here they are a source of crime an expense and a problem,1
582,What is me I will not allow myself to be vaccinated again by anything that comes from this government Let the politicians the judges the approved ones the various orcs the immigrant lovers the priests the EPP get vaccinated first and then I will think about whether I start thinking about getting it,1
583,Chile disastrous A painful image the culprits only thinking about being President and our young people blind hypnotized by the beautiful words of the left Tomorrow will be late The immigrant has zero contribution There is a lack of strong shaking and management,1
584,The Canary Islands ask for help to manage mines and only receive an offer to relocate through Very soon we will see them wandering the streets of all of Spain stealing and occupying homes with the permission of the government,1
585,When everything is given to the immigrant especially the Islamist we must fight and survive because they want to destroy our race customs and culture,1
586,Chileans spend years some more than years fighting for their own house or apartment Own and they give it to a Haitian immigrant what a shame Plus they have barbecues and play ball in quarantine they dont respect anyone and if you say something to them its discrimination What a pity,1
587,The Haitians had an airline entirely dedicated to migrant smuggling LAW Piera has legalized any illegal immigrant who has entered through border crossings on foot illegally Both are equally disastrous and must pay,1
588,Yes hello FUCKING IMBECILE Do you think youre very tall for your TDs That doesnt take away from the fact that your mom weighs pounds of shit and you live in the shittiest neighborhood in the United States FUCK YOUR BLACK WHORE CAMEROINS IVORY SENEGALES MOTHER SWALLOWER YOU FUCKING TOOTH,1
589,I dont want to offend you but almost no immigrant has a noble past,1
590,But now saying that MANY foreigners came to Chile through human trafficking is being racist You dont understand the concept As an immigrant I can say with knowledge that Chile MUST control its borders Not just anyone can enter,1
591,The criminal immigrant who comes from banana countries yes is indeed more criminal more violent and dangerous because he is accustomed to the reality of a lawless town where the law of the strongest governs and human life is worth zero cents,1
592,EVERY immigrant without verifiable higher education is not a contribution to Chile just a piece of shit who came to take jobs away from our compatriots without education DEPORTATION of all illegal and uneducated immigrants,1
593,Then you die stabbed by an immigrant family for being a good Samaritan the church generating guilt since time immemorial,1
594,So the femicide is transsexual a Mexican immigrant and friend of Sebastian Izquierdo I did not ask to be born in this shitty generation that has denied me everything in life conchetumadre,1
595,Of course they dont distribute them to our coastal towns because we already have the MENAS and all of Africa with the Top Manta and their trinkets on the promenade protected by the City Council the local police are afraid of them the desperate merchants,1
596,The truth of the facts cannot be changed or disrupted While in our nation called Spain there are thousands of Spanish families suffering from hunger those who come by boat staying in hotels the monarch and the government are guilty The rest are all fallacies,1
597,Get on a boat and go to Morocco youre useless,1
598,Who takes care of the blocked Spanish truckers Now I understand they dont go on a boat,1
599,moreover immigrant the ctm think about it,1
600,Today in the afternoon if you took a walk through the center what you saw most were crews of idle menas,1
601,Woman and Femicide the orc ctmre as much All this makes me sad and helpless how many women will be suffering because of so many immigrants monkeys kliaos Central Americans murderers it is well known that their culture is sexist and misogenous,1
602,And residences for menas run by faithful militants and charging atrocities,1
603,Youre a fucking kidnapped kid Get out of that dictatorship shit now Surely some boat is waiting for you,1
604,Precisely iker there is also a lot to investigate in NGOs between October and November they have received million euros Lets see if you could know how many companies are alive of puppies kittens childhood hunger menas Its really sad,1
605,Barcelona is now Warcelona I found out that minutes from my house there is an ore center How quiet the City Council was Of course for some time now there was a lot of movement More bottles than normal etc,1
606,And while we maintain their rights they steal attack and rape Come on were doing well,1
607,It is true the government and Congress do not give it importance The unfortunate thing is that the immigrant who enters the country is poor and they take advantage of the weaknesses of the system Free health and education among others Its hard to say but whatever the wave throws up comes and taxes take care of it,1
608,Jokingly I have come to think that maybe I had to throw away my documentation sand my fingerprints buy a boat and turn around in the middle of the sea to see if it slips in and they take me as an immigrant As a selfemployed person who was hooked for K in nonpayment I have no aid,1
609,Or entering Morocco by boat they will beat you up as soon as they see you If we are idiots damn,1
610,Well not Iker On the other hand everyone who arrives in a boat has an open letter to all kinds of help Just like any Briton who comes to Spain to have surgery and returns to his country with ease and leaves the bill to pay,1
611,And what do you care go to your country come on oh you dont count as an immigrant,1
612,There are more theories that are not misguided about a covert invasion of Europe and about drug and weapons mafias where they introduce mules among the real immigrants An exhaustive identity check could be carried out with the collaboration of Interpol to know who enters the boat,1
613,fucking immigrant,1
614,Hit it hard iker you are the best GET OUT OF OUR NEIGHBORHOODS And the kitchen doesnt like it,1
615,Others whitewashing illegal human trafficking and slavery Male immigrants to work for the drug mafias in Spain and immigrant women to prostitute themselves in the streets and industrial estates to pay the boat ticket to these mafias,1
616,what they had to do as they took them from the boat put them back on a boat and took them back to the boat where they had left them enough,1
617,Do you have any idea what its like to walk along the promenade of the city of Cdiz meters from the main avenue and suddenly see yourself surrounded by immigrants who have just arrived on a boat to the beach Something like this had never happened,1
618,Illegals who come by boat receive more help than Spaniards who have been exposing themselves and working hard during the months of confinement,1
619,Here Who says that she is proud of her party that she has spent million euros on unemployed people on whores and cocaine that she prevents investigating the prostitution and rape of MENA girls in the Balearic Islands that is responsible for deaths that she makes an agreement with ETA and racists What they are,1
620,No maam I pay for that with my Social Security contributions the one that you give free to every immigrant who comes I pay for it and they deduct it from me What the hell free Free is for you who surely do not have anything paid for like immigrants You will have a hard face,1
621,The Mohamed VI extends its territorial waters to the Canary Islands claims Ceuta and Melilla we raise the menas we house the illegals in star allinclusive hotels we pay for their vaccines they are the preliminaries of the annexation of Spain to the kingdom of Morocco,1
622,This Luca was making me sick she knows perfectly well that it is illegal and mafia immigration that is sent by Morocco to invade Europe and she still says nothing happens they sent everyone to her fing house with Luca in a boat,1
623,I prescribed some time alone with the MENAS who are loose without a leash in Casa de Campo,1
624,In gyms the Patera Diet is becoming fashionable to gain muscle mass,1
625,If you take your minor child in the car without a seat belt you will get a fine that will make you crazy and hope that they dont take custody of you if you put him in a boat to cross the strait they will give you a little money and money into the sea,1
626,Madam they come legally by plane and we know who is coming In patera we have no idea The last attack in Europe a terrorist arrived via Lampedusa in a boat In the s we Spaniards went with a contract and when we finished we went to Spain He doesnt know what hes talking about,1
627,If a socalled immigrant arrives in Spain he can move to any country in the union and they always give him help be it food a bed or clothing If a Spaniard moves he receives no help so he cannot move in the same way and is always at a disadvantage,1
628,Four poor people coming in a boat Four hdp who come to live like a king How angry holy god,1
629,NGOS are funded by every illegal immigrant that reaches the shores of Europe They provide false passports false nie and means to settle work and raise money to pay the NGOs for their trip to Europe Spain is going to use the Turkish model,1
630,For this government an immigrant who contributes nothing and consumes is worth more than a Spanish worker who produces and contributes They hate Spain and the Spanish who are the ones who keep them in their official positions,1
631,And now you go and say that integration is close LESS to your country we dont have to support other peoples children,1
632,NGOS promote the slave market in Europe Each immigrant receives a pension they work and earn money They contribute a percentage of their income to the NGO that brought them to Europe Slave Market sponsored by NGOs throughout Europe,1
633,Being called a xenophobe or racist for treating an immigrant who commits a crime as a criminal is the same as being called a classist or discriminator for treating a poor person who commits a crime as a criminal Neocommunist progressive totalitarian Leftland only sees good immigrants and poor people,1
634,If my name was mamadou and I lived in Mauritania seeing everything they do in Spain I would have already come in a boat fucking government,1
635,Our kidneys pay for the vaccines your salaries the hotels and surf courses for illegal immigrants the maintenance of the menas your purchases of defective material the nonsense posters of the Minister of Inequality and the Falcn,1
636,All of us who are legally and pay taxes pay them Illegal Immigrants and Menas NO To emphasize that you try to cover it up,1
637,The shot that would hit him for being a black shit,1
638,The UN band and they look so hot Those who are Menas return to their homeland and let their government carry them the rest will burst doing social work,1
639,To this gov you are more interested death the life of the old and those who are going to be born the illegals and the menas that is the parasites the poor truckers trapped in England the squatters and ticks who dont pay taxes the middle class who pays their salaries THEY ARE TRASH,1
640,I read an immigrant with an expired visa who left Chile returns for an illegal step Thats how easy But what is more serious is that the subject intends that the process to achieve definitive must continue Controlled upon leaving Perception of zero control at borders and facilities for these people to stay is impressive,1
641,ILLEGAL in days Everyone to hotels They were eager to break up the Arguinegun camp so that we Canarians would not see the thousands of ILLEGALS who come to live off the story Rescue rescues another boat with North Africans south of Gran Canaria,1
642,Yes yes but why do you start putting it on us and insist so much that we put it on Since youre not going to answer me you stupid bitch Ill answer myself for you Because you want to put an end to the Spaniards and give the country to your dirty children,1
643,The Sons of Anarchy soundtrack makes you want to kill a Latino immigrant,1
644,Yes thats how it is They are going to vaccinate the menas and the tourists of patera before they vaccinate you hard worker,1
645,Look at the comments hahaha what a crazy country If he had come by boat he would have been named Count of Mallorca at least and they would have evicted Nadal to give him his house,1
646,Exactly exact According to balos the society that this government wants for Spain Criminals Traitors and similar individuals If you dont belong to one of these groups or if youre an illegal immigrant thats okay you have to listen to their string of nonsense and shut up,1
