,Cleaned tweet,Tag
952,The menas are clashing with other gangs for control of the neighborhoods Why do we have to take care of minors from other countries that only bring violence and social disorder This government does not want to see the damage they are creating in Spanish society,1
953,The dream that we all give you the mother is fulfilled Fuck your innocent and whore black mother herd passion They look like kids with that April Fools Day nonsense,1
954,Its just that I fucking hate Carvajal as hell Go beat up the menas with your friend Abascal and stop making a fool of yourself on the field,1
955,shut up immigrant support violins do you have an opinion,1
956,This summer in Catalonia a longdistance bus two men got on a longdistance bus without a mask or a mask on the driver they lit a joint and to get his attention they called us racists the Mossos dEsquadra came they left them on the bus and with an escort to the destination point,1
957,If it were a moor of the boat there is no problem,1
958,shut up immigrant,1
959,Suck me off you fucking black Mexican youre happy to kill a life but then you complain that theyre killing you you shitty assholes your whole movement is a circus youre just puppets of the fucking government open your eyes Mongolian shitty,1
960,Media we are not faades Headlines covid is invented by young people Catalans and Moors in a boat financed by Marias plantation that has the pigtails caseplon in the basement,1
961,Crazy shit now I understand why Black beggar leabian fuck,1
962,The cost of vaccines of whores of cocaine of menas of illegals of stupid studies of those I dont know about you talk about what money from Andalusia I didnt go to you are very into getting things out of budgets and hunger to town Congratulations,1
963,The MENAS must be expelled,1
964,MENAS and illegals maintained and financed and selfemployed and SMEs abandoned to their fate and fodder for depression divorces and suicides Progressive governments,1
965,Damn hes Moroccan its a fact another thing is that Moroccan shit makes me fucking disgusted,1
966,Let him talk about the FAST AND FURIOUS operation WHERE THE CONSCIOUS KNEW THAT WITH THOSE WEAPONS SEVERAL MASSACRES WOULD BE CARRIED OUT IN MEXICO YOU FUCKING SHIT BLACK FUCK YOUR FUCKING BLACK MOTHER,1
967,THIS IS TODAYS CHILE A DISGUSTING PURE IMMIGRANT SHIT PIGS SCORES THIEVES THEY LIVE OFF THE STATE AND OUR TAXES ZERO CONTRIBUTION AND THEY DESTROY CHILE TODAY WE ARE THE COVER IN THE WORLD OF BEING A FILTHY COUNTRY,1
968,The government is too permissive with the menas,1
969,Today a shitty black woman looked at me so badly that she gave me a fight I never reacted but I just threw her to hell whats wrong with them theyre geniuses being bad Tall idiots,1
970,My dad yesterday said how strange these shitty black women fighting in the river and it turns out that a shitty black woman as he says is my cousin HAHAHAHAHA,1
971,AMAZING THAT THE BASQUE POLICE TOLERATE THE VIOLENCE OF AN ILLEGAL MAGREBI WITHOUT A MASK AND LET HIM GO An illegal immigrant before the State Security Forces who require him to put on the mask failing to comply and defying the agents,1
972,Suck my fucking black cock go wash the dishes,1
973,Yes I fell asleep watching them but why did I see them at in the morning but they are entertaining and they are the dick fucking ape,0
974,Cat you are a full virgo Harry Potter I love you too you black shit,0
975,Things from Sudaca that it makes you depressed to see the Christmas decorations in the first world and that in your country you cant even put up a light bulb because they will chore it up,0
976,Im bored by kids who dont invite you to anything even if its just something to chat on the sidewalk juira,0
977,Charity starts at Panchitos house,0
978,Completely I miss having the bars close to home the parties from which you came kicking back at am The panchito in the Illia post bowling and so on,0
979,As in Portugal Porto has recently been the champion with Mexicans playing and I dont know Marchesin as the goalkeeper And in Atltico mmm I do not remember The last sudaca figure was Falcao,0
980,I find it terrible Its crude when the press starts reporting incidents like this which usually get a lot of buzz Of course demonizing an immigrant is tastier Hopefully the migrant communities in Chile will not be so affected by the wave of hatred that is going to come out of this,0
981,We return to the old discussion no one is bothered by the immigrant what bothers them is the poor They say its called aporophobia in this case its the same thing,0
982,What Rben Limardo does with his life tastes like ass to me Im thankful that he didnt have to be an immigrant in South America he didnt have to walk to the border suffer cold hunger and mistreatment by Venezuelan officials He didnt even go through the Saime torture for his passport,0
983,If they dont win the sudaca has to resign until Mareque,0
984,What do you say panchito,0
985,In other news Amelia the one inside caught a mouse and left it at the entrance to the patio She almost died of shock The other michi is Panchito another neighbor who sometimes comes for food I love them and would like to adopt them but dealing with feral kittens is very difficult,0
986,Yes one huifred Oh and soon panchito,0
987,After two years the InCorrecto record label returned with El Sudaca Contrataca Vol IV In this edition they explore the electronic sounds of Latin America here we tell you everything about this project,0
988,Mario Austin and Panchito my favorites,0
989,If I have to choose one always hot,0
990,Panchito Panchito give everything,0
991,It is a country of immigrants you can be aggressive to enforce the law but not treat everyone like animals Covid was very poorly handled in some terms of border closures,0
992,lets go for a beer and then for a hot dog,0
993,Oh how much Panchito membership would be The Vatican bank bankrupt before Panchito is flourishing today,0
994,A panchito from the square plays,0
995,A friend is traveling through Europe and every time she eats a panchito she sends me a photo saying in your honor,0
996,Panchito if he wanted he could mention our country in a blessing through a tweet these assholes who govern us think we are as naive as them,0
997,The problem is that they generalize any immigrant because they need to establish an enemy It is a very simple speech to capture the vote of simple minds They repeat mantras of this type at all levels and you know,0
998,Im ready for a panchito del rey,0
999,It is the personality of most Nordics countries with the highest standard of quality of life Shut up sudaca and keep watching football they would tell you,0
1000,Poor Why are you working like any immigrant He has been living in Poland for years better off than any poor person in Venezuela should be,0
1001,Panchito for the movie titles bro,0
1002,Zahira thinks that immigrant is an insult or what,0
1003,Very worried Panchito,0
1004,Thats why I pay for my trips abroad and I am a NONIMMIGRANT TOURIST so they should be careful who they scrache abroad,0
1005,Wow what caution in the headline He was thinking about police unjustly detain a young immigrant accusing him of committing alleged homicides,0
1006,Poor Lapadula he agrees to be Peruvian to play for the soccer team and go to the World Cup he arrives to play and bang he carries out a coup dtat and graduates from sudaca,0
1007,Im so hungry Im going to eat a piece hot dog,0
1008,If you change your address times are you an immigrant times Amos go And good night,0
1009,Down flimsy The middle a lot of playing until Up Palacios did not win a headsup A predictable team Without individual imbalance Without hurting You have to give him a lot of support Panchito castro Macari Deaf,0
1010,Jogging in the park and panchito seems like a great plan to me,0
1011,Yes the attitude of bringing an immigrant to slobber on all the programs is totally condemnable If he wants to go out with her let him invite her But dont be the Macho Man using the audience as a witness Its big now How was he calm last night talking about clowns,0
1012,Heavy traffic in Salvador Nava center lanes heading to the roundabout due to a vehicle crash It goes long Look for alternative routes,0
1013,Fratelli Tutti is a call to love to extend this love to others to the immigrant from a neighboring country whom Francis calls the existential strangers Also to disabled people for two other examples It is a call to the universality of love,0
1014,Quality immigrant when they give him the keys to the city,0
1015,Even if you dont change countries if you leave your life behind to start somewhere else you are an immigrant Look at the RAE,0
1016,A desire for a panchito,0
1017,If we already qualify for next years Libertadores we are going to win the Sudaca and we bet everything on the cup,0
1018,The largest European economy does not spend a penny on an army cheap immigrant labor a stateoftheart industrial and technological park a cultured nation with excellent values so anyone is a successful ruler They send Merkel to Latam they carry out a coup dtat every year,0
1019,that creates this dramatized figure the bourgeoisbohemian the wellthinking The progress Son of dads children from May First pseudorevolution without workers nor poor nor dead These are the ones who today idolize their new martyrs in the immigrant deprived,0
1020,Fucking shit immigrant thought we supported each other,0
1021,He has to do as rasin and try to qualify for Sudaca,0
1022,He has to go before he makes us stay out of the sudaca,0
1023,The context of the immigrant of Parents from India and Jamaica of color is what it represents for it is not romantic it is factual Not everything is beautiful but what is beautiful is And it is less pious than TruN,0
1024,the sudaca was nothing more after that he returned to his usual state and scored the goals alone,0
1025,Superfluous like you they wouldnt last a month living what an immigrant lives But what can we expect this is already a typical thought of a whole pack of corrupt incapable and inept officials,0
1026,Chek out What is that I dont think you know what angry means Ha ha ha What a strange thing for an individual Goodbye panchito,0
1027,Panchito really is very rude Im sure he has no evidence is a phrase that only someone who did do what they accuse him of would say,0
1028,There are no screwed games with the level of Sudaca soccer only Brazilians and Argentines who are River and Boca have a chance of winning it,0
1029,We became a rug we became an antiimmigrant wall we became the police of racist populism Now its time to stop being that Now it is up to AMLO to understand it writes Denise Dresser,0
1030,because they feel like it if she looks like a xenophobe who says sudaca,0
1031,The legs are a bag of jaivas I am an immigrant in Norway and I have never demanded anything I have only worked and paid my taxes,0
1032,Ive been sad all day and the only thing that made me happy was Panchito when he came to my room and climbed into my bed,0
1033,million a stove hahahaha black shit how I hate you hdp,0
1034,Netflix Spain has Oceans I DONT DESERVE that is you cant imagine the amount of viruses that enter my PC because I need to see that movie every day and of course I see it in movies panchito com,0
1035,And every day is shit because the world around us is shit but if you dont get cool about it no one is going to get cool about you you black shit we,0
1036,Obviously renewal has a cost but here the fact that an immigrant pays for an appointment that is completely free is being criticized,0
1037,To finish this thread It is dangerous to generalize immigrants with criminals Hatred is encouraged and some brainless person can beat up any black boy who is from the Canary Islands for confusing him with an immigrant,0
1038,Yours is sick you go against anything that is in favor of the citizens you prefer that the vulture funds the immigrants and foreigners who gouge out your eyes in the rents are funded you hate only the poor immigrant you go against Spain and then a lot of flag,0
1039,Choosing the immigrant ambassador last year my partner was my boyfriend and the one who led the dance was one of my best friends So magical that the music was part of the background we danced for others and at the end the scream of my friends in the fans It was all music,0
1040,My cousin who is in Spain has been an immigrant since but my cell phone has little memory capacity I couldnt open the link and I could only download the video to the computer,0
1041,I would be going to the Immigrant party But thats how it is,0
1042,Hold on to South American football the music of the South of the continent and you when you smile,0
1043,every time a sudaca loses his accent in espaya a part of me dies T T,0
1044,He is a Swiss immigrant If he were Moroccan he would get involved,0
1045,Well at least the guy works like any immigrant with dignity the pluggedin ones dont work in delivery Devils lawyer,0
1046,My social circle is so diverse that sometimes I get the how so sudaca a okay botana from Tampico shouts with a Tabasco accent and I ask in a northern tone,0
1047,Go rest review your Spanish and organize your ideas Then he comes and decides if he is going to respond in Spanish or English Any immigrant who never had Venezuelan nationality but lived there would understand what I did and I wanted to say Im sorry that your neurons dont work for you,0
1048,Did you know that Donald Trumps grandfather was a European immigrant who came to seek luck in the new world Yeah Donald Trump The same one who wanted to build a wall to prevent the entry of Mexican immigrants,0
1049,Apart from the laughter it causes The point is this is the plan They look for a new revolutionary subject and this is where Cultural Marxism is born and they find this revolutionary subject in immigrants drug addicts prostitutes and even mentally ill people,0
1050,The lies are the means that the right uses to manipulate the working class who look for someone to blame for their misfortunes and it is easier for them to blame the immigrant the Bolivarian red than to stop and think who benefits from being slaves,0
1051,Welcome to the real life Mother Foka now enjoy the life of an immigrant and break that ass years living in Poland and youre a Chavista You have to have a friendly face Now lets pedal what a joke and gentlemen now in Poland it is possible for a Chavista to deliver you food,0
1052,Honestly right now the dogooders are not helping it is not a time for political correctness it is a time for truth Trump did nothing toxic against any immigrants that was a media distortion Im sorry love this lady but its time not to be lukewarm,0
1053,Venezuelans who live in the United States I remind you that currently the President is Trump whether you like it or not respect that country it is not Vzla who goes on a rampage with offenses and threats it can end very badly This is how they create the big dick you were not born there and are seen as any immigrant,0
1054,IMMIGRANTS come to take our jobs People have this in their heads that if you say that immigrants dont love them they vote for it because they believe thats the case that the immigrant is coming to take our jobs and you are going to kick them out,0
1055,Im also from Sudaca and although I love the playoffs there are also many unnecessary stops,0
1056,In my opinion Francisco that there is an immigrant as a constituent elected by vote and of course that he meets the minimum requirement of years living in Chile no problem but here they are referring to seats reserved for immigrants I suppose That would be terrible,0
1057,THE Audiovisual contest The Italian Immigrant extends its application period until tomorrow November,0
1058,The first time I danced at the immigrant party with my community and I dont have a song because I dont know the songs of my community and I would play one of those xd,0
1059,HAHAHAHAHAHA what a fucking nigga,0
1060,Trumps antiimmigrant speech seems to have had effects on the behavior of racial minorities since according to data from the aforementioned survey they have voted overwhelmingly against him,0
1061,The Spanish government perpetuates a system of torture and murder in its laws being an immigrant means being an outcast without a future or rights who due to lack of rights on the part of capitalism is deserving of being exploited,0
1062,Trumpism only brought to light that open secret of American nationalism racist classist antiimmigrant intolerant narcissistic etc etc etc The surprising thing is that entire cities full of Hispanics continue to support that thought,0
1063,This account two centuries ago would be sending Andrs Bello or any other immigrant who accepts this land as their home to silence,0
1064,Ta strong Well my panchito is that way so can I say that my house is valued at million if we add the cost of the land But they are shameless,0
1065,And if you dont believe what I say investigate partner maybe you dont understand that this is the usual story of the greengrocer to justify the muddy messes he makes and Ill tell you another one if he didnt know why he didnt classify Sudaca he lost a lot of money and whose fault was it that from the fans or who,0
1066,Thanks to the efforts of immigrant mom and immigrant dad New York City kept going during this pandemic That is why we are going to ensure that this new presidentelect fulfills his promises to our immigrant community Yesenia Colmena ED,0
1067,And it is because of his xenophobic comments and statements that he made at the time in a campaign that helped raise his Hispanic votes For example in Florida he said that Biden was a communist if you say that to a Cuban or Venezuelan immigrant well of course He is afraid and does not vote for Biden,0
1068,You cant sink any lower with your shitty dark humor,0
1069,Well can you explain to me why so many immigrants are entering Spain without any control If not for a plan and some agreements Before not as many came from Morocco as now They held them and did not let them arrive and why now,0
1070,I remember an argument with my roommates in Brussels The French what was the difference between an expatriate and an immigrant,0
1071,HAHAHAHAHAHAHA black shit,0
1072,Many of these attacks are driven by a condition called xenophobia Xenophobia is the phobia of a foreigner or immigrant whose manifestations can range from simple rejection through various types of attacks and in some cases lead to murder,0
1073,Last chance You have a new deadline now until November you can send your short film for the Fare Cinema Audiovisual Contest The Italian Immigrant To consult the bases on our website and,0
1074,It was a colony until December Is it before that time She is an immigrant who leaves nonsense,0
1075,If an immigrant is looked at with positive eyes we can see a great asset which is the diasporic gene a brave gene it is not easy to leave everything and leave a place to survive they are strong,0
1076,Find out the details of the fourth installment of the record labels electronic music compilation,0
1077,Yes this story is so strange if you are a deputy for the PSUV what are you doing in Poland and you are not working Why does he want to paint himself as the longsuffering immigrant instead of working like he should in Caracas,0
1078,Yes you pay money every month and they give you a cellar with a bathroom and a roommate pig Mine is a colleague on my team but he is a fucking ape,0
1079,I have reported VOX voters on the day of the inauguration of the headquarters to my daughter who is BLACK MULATA born in Spain at the age of these told her you black shit go to your country you shitty immigrant a thief and things Worse they were from VOX because they carried the flag,0
1080,You have everything distorted and I feel sorry for you I dont give a damn about the Democratic Party like the Republican Party my party is my country there you with your tumbao and fanaticism I am an American and I care about the decent immigrant who seeks the future of the collective God bless,0
1081,If losing to Boca means passing the round in Sudaca then come those goals,0
1082,Martha is a professional political democrat black from a recent immigrant and not wealthy family she talks about human rights and also about gender equality she does not mention violence or the military,0
1083,Osama Hosna immigrant Muslim and hero of the Vienna jihadist attack,0
1084,In sexist crimes there is an underlying poison The executioner can be old cannot control himself or young cannot control himself or an immigrant with different customs or Enough lies sexist violence has to be shown in the media not justified,0
1085,Finally someone said it the other day the sorete threw me the other day you only play soccer fucking nigga,0
1086,Please if you can help me I will be very grateful I am an immigrant living in Ecuador and the pandemic has greatly damaged our family,0
1087,If Covid was an immigrant child they would have done everything to prevent it from entering the country but since it is a virus that kills mostly the elderly and minorities none of you give a damn Fuck you by a thousand,0
1088,If it were just that I dont agree with it but I would understand You cannot compare a blood crime with a boy who sells on the street to eat or even steals from a store What is worrying is the sowing of hatred towards poor immigrants who do bring diseases those who come in first class right,0
1089,I also remind you that in this country if you are talented and you dont take a photo with the politician on duty they wont give you half a cent He is an OLYMPIC CHAMPION and deserves respect now he tries to make an honest living like any immigrant,0
1090,But your IQ is more equal to a fucking ugly ape,0
1091,Its also that aha the mental hurdle that they dont recognize their immigrant situation and adapt if not continue believing themselves to be tourists forcing others to understand it Im not sure if I explained it well,0
1092,My mom lives there and people are very derogatory towards Latinos so stop painting everything pink on this specific issue Terms like perucho sudaca etc They are widely used there so what are we left with,0
1093,Saying black is not an insult my daughter and my wife are black an insult is saying a fucking black woman I hope you die that and many more immigrants go to your country miserable thief etc thats what they told her and much more she was insulted by and the other who were without saying anything without,0
1094,And who cares what this murderer says Be ashamed woman Do you support someone who locks children in cages and attacks immigrant people Like your nopalera,0
1095,in the process of adaptation to American society Its philosophy and the center of its mission is to help the professional immigrant community and turn it into a valuable asset for our country rescuing its professional identity and with it its selfworth and selfesteem,0
1096,What does Roci say that she is not an immigrant lest those from VOX harass her in front of her illegal chalet,0
1097,Ive been following you for centuries Marco hahaha long live the rastabar and TNT parties I have to win because if I dont laugh at the end of the world I feel like the world is going to end up laughing at me and everything I have to endure as an immigrant GOD hahahaha,0
1098,Immigrant in Caballito Today we had lunch with two gastronomic ventures in the neighborhood Los Zavalua and Al Rayan The stories behind it excite and motivate us to continue working to bring more and more facilities Thank you,0
1099,I am an immigrant so in this country I do not have a family member to ask for help It is better to go out to work than to ask I have always been a worker standing up for the family since I was years old The recession unemployment and my almost years dont leave me many options,0
1100,HAHAHAHA Argentina nonracist country It makes my tits laugh because of idiots like you these commissions have to be set up in a country where fucking black is common currency,0
1101,We are more connected than ever He gives as an example the pandemic the supposed end of globalization How it ends Vaccine created at record speed by pharmaceutical companies without government subsidies based on German biotechnology by a company founded and directed by a Turkish immigrant,0
1102,What happens is that you are incapable of being objective with a young immigrant woman Being a drug addict does not make you a murderer nor does using drugs an excuse from criminal responsibility PS the one who is not going to be cured is the girl who died of hunger and thirst,0
1103,This political party is opposed to the immigrant population and social policy valid in Spain The headline reflects the ideological intention using sarcasm manipulation and random attack taking advantage of the events that occurred hours before,0
1104,The spanish government In this way Mr Ndongo wanted to attack the immigrant group more specifically to unaccompanied minors since the boys are of North African origin and increase the rejection of some of the citizens towards these vulnerable young people,0
1105,Thats right and a player Rocho de Velezs girlfriend died recently dont be surprised if the linemens club wins the sudaca outright,0
1106,Sara yes if so I am proudly from Sudaca because I live in peace and quiet okay,0
1107,Taxes on what Paying taxes to buy clothes and food is not like you are contributing much to the country it is done all over the world An intelligent Immigrant is one who goes to work and returns to his country to contribute to its growth the rest is pure personal selfishness,0
1108,Behind Pfizer is the son of a Turkish immigrant who worked at the Ford factory in Cologne,0
1109,I love that there are people who are defending the KKK Madreh the first to shit fire is you for Sudaca and you defend them,0
